INDEX,id,post_title,created_at,num_comments,score,selftext,upvote_ratio,comments
FAST04-11,8b1clg,"This fast growing Chinese luxury retailer (Secoo Holdings) is valued equal to net cash, or 0.6 times book value or 6 times earnings - any thoughts or insights??",1523303095.0,10,7,"Obviously Chinese microcaps are **high risk speculative investments** but this looks ""too good to be true""

Last year there was a big preferred dividend that wiped out EPS for common stock.  But the preferred stock appears to have been fully redeemed at year end.

Any thoughts or insights welcome

Theres an article on Seeking Alpha (Ticker SECO) but unfortunately I cant upload the link 

This post is not a recommendation to buy or sell any security or derivative. Stocks are not suitable for all investors. Please do your own research.",0.71,"[""Almost guarantee you this is a fraud. I haven't looked into it, but it fits with just about every other fraudulent Chinese company listed in an american market."", 'What happened to your disclaimer that ""I have no known connection to any of these articles, the author or website."" ??', 'The China Hustle on Netflix ', 'When something looks too good to be true, it is', 'I\'m not familiar with what you mean when you say ""but the preferred stock appears to have been fully redeemed at year end."" \n\n I understand what preferred stock is, but what does it mean for it to be redeemed, and how does that mean they can\'t have a similar preferred dividend this year?  ', 'fake']"
C04-13,8ab90t,Insurance companies,1523034471.0,6,2,"Looking for companies which are somewhat inflation proof, started thinking about insurance companies.

The upside is that they can easily increase their pricing for inflation. The downside is that much of their investments are in gilts.

But the thing that confuses me is their P/Es all seem to be crazy low. In the 8-15 range often. Seems like a steal. What am I missing about this industry that it’s so Cheap?",0.67,"['Insurance companies derive most of their profits from investments, which means their prices tend to be highly correlated with the market (beta near 1). If you want to invest in an insurance company, you might as well just go with brkb.', 'Plus, when it comes to insurance if a company does not have a solid underwriting team they will lose money a good amount. The key for insurance companies is solid underwriting, a good investment portfolio, and staying clear of getting greedy. \n\nI have to agree with daveyfck1, Berkshire owns some really solid insurance companies that have turned an underwriting profit most years. Other than Geico, they mostly deal with long-tail insurance which are the policies that are unlikely for example, insurance on a doctors practice that covers them against malpractice. \n\nWhen it comes to their investment portfolio, it is all operated by the man himself Mr. Buffett. Now assuming you will be holding investments for a long period of time, the two other investment officers, Todd and Ted, are also extremely good capital allocators. I believe that once Buffett passes the investment portfolio will be in good hands. \n\n', 'P/Es are low in comparison to what? One of the first things anyone will tell you about P/E is that it’s not to be used as a final be all number for all companies. Different industries have far different average P/E ratios. As you’ve already noticed, insurance companies tend to be in that P/E range you stated. Compare insurance companies to other insurance companies and understand why some may be higher than others', 'Why do you think insurance companies are inflation proof? Also, why are you worried about inflation right now? Signs are pointing towards rising rates.', 'Insurance stocks have already peaked.  Nearly all are trading below their 200mda, which signals downward trend.  The low P/E is financial engineering with increasing share buybacks and low interest debt management, which both are coming to en end.']"
WFC04-13,8bhk4a,Which banks stocks do you like here?,1523457528.0,17,6,I don't have any financials in my portfolio at the moment and want to pick up a bank stock however I have a hard time evaluating bank stocks. They are just to hard for me understand enough to be able to decided which might be a good investment. So what things do you look at when evaluating bank stocks and are there any that you think are a good buy here and why? ,0.8,"['JPM!', ""Regional banks have been outperforming the S&P this year, and still look to have some room to run with the dialing back of Dodd-Frank.\n\nI'm not well versed enough to pick out the winners, but I think the sector is primed for strong growth so I own FRBAX, a regional bank mutual fund.\n\nFWIW, the top holdings are $PNC, $STI, $KEY, $BBT, $USB, as well as $BAC and $JPM"", ""I've owned Bank of America since the single digits. I also have JPM, American Express and recently Wells Fargo. \n\n\nI think BAC/JPM are both in strong positions right now and both are well run. They'll both benefit from rising rates.\n\n\nAmerican Express gives you exposure to both payment processing and is a benefit to rising interest rates. Loan revenue rose 14% last quarter and card spending was up 11%. Their P/E is lower than the industry average and they have an impressive cash flow. \n\n\nAdditionally, I began buying WFC at $55 down to $52. At this point, things cannot get much worse for them and I'm playing the long game with them. Eventually, the Fed will lift the growth restrictions and they will right the ship. It's too big of an institution for them not to fix their issues. The stock has lagged the market for a while now and trades at a lower multiple than other bank stocks. If it dips below $50, I'll buy even more. "", 'SCHW', ""I've just started looking at some banks to ad to my portfolio to get some financial exposure. What are peoples thoughts on ALLY? Seems to have an attractive PE, but much more debt than BAC and JPM. "", 'I bought a bunch of $USB when it dipped', '$BOKF due to energy.', 'LYG, share price beaten down by brexit fear, great stock for the long run IMO', 'I believe BAC, JPM, and WFC are all solid big banks. As of now, I believe WFC is the best value at the moment. ', 'JPM is above the rest in my opinion', 'MS. Gonna be a lot more rich people using their wealth management services.', 'All of them', ""I'm a big fan of the Canadian big five banks. High dividends, steady history of growth. "", ""BB&T & SunTrust. Can't predict the upside, but they appear to have conservative balance sheets.""]"
WFC04-13,8b0n07,This is the week for gains in the financial sector. DD inside. (x-post to r/wsb),1523297810.0,1,0,"TL;DR: I think there is strong possibility of strong gains to be had this week in the financial sector. Buy in by COB Wednesday to take advantage, and exploit using $XLF options or $FAS.

Thesis: The financial sector is one of the most undervalued in the market right now, and as earnings season begins I expect the market to finally give the sector the attention it deserves. Reasons:

1. The financial sector is tremendously undervalued right now when you [simply look at ratios](https://us.spindices.com/documents/commentary/dashboard-us-select-sector-2018-03.pdf?force_download=true). At 18.3, the financial sector currently has a P/E ratio that is not only the lowest in the S&P 500, but [is in line with historical P/E ratios](http://www.multpl.com/), unlike many sectors right now. 
2. Earnings should be strong for a couple reasons. One of these reasons is that net interest margins, the difference between the interest a bank pays and the interest it receives, [has been expanding](https://www.nasdaq.com/article/jpmorgan-citigroup-wells-fargo-and-pnc-financial-are-part-of-zacks-earnings-preview-cm945379), possibly more than analysts have been expecting.
3. Another reason to expect strong earnings is strong economic fundamentals. The market has had ADHD recently with concerns about tariffs, $FB data usage, Trump tweets about $AMZN, and so on. Investors have lost sight of the fact that the economy is pretty strong right now, but earnings season will remind them of that. We have great job numbers, rising household incomes, high consumer confidence, and so on. These are conditions that lead to high use of the financial sector among both consumers and industry.
4. Another reason for strong earnings is this is the first quarter of earnings after tax reform. Enough said.
5. FAANG may finally be becoming passe. I realize as I am typing this that $NFLX is up 3.5% today (though on low volume) even though it has a P/E ratio around 232, but the market seems a bit more skittish around tech ever since the Cambridge Analytica news came out. Retail investors are being dumb and buying the bubble, but [big investors are very short on tech right now](https://blogs.wsj.com/moneybeat/2018/04/09/hedge-funds-turn-bearish-on-tech-giants/). (If you don't have access for WSJ stop being a pleb. Ask mom to buy you a few less tendies this week and get you a WSJ sub instead) [Valuations for tech right now are insane](https://us.spindices.com/documents/commentary/dashboard-us-select-sector-2018-03.pdf?force_download=true), and buying in right now seems to be typical WSB buy high sell low autism.
6. This week kicks off earnings season. On Thursday, [$OZRK and $CBSH announce premarket](https://www.nasdaq.com/earnings/earnings-calendar.aspx?date=2018-Apr-12). On Friday, [$C, $FHN, $FRC, $JPM, $PNC, and $WFC are all announcing premarket](https://www.nasdaq.com/earnings/earnings-calendar.aspx?date=2018-Apr-13). All of these are forecast to have improved YOY EPS, and some of them significantly so. P/E ratios for these are respectively: 14.14, 20.62, none, 27.41, 21.09, 17.86, 14.57, and 13.06.
More importantly, one year forward P/E ratios for these are respectively: 12.65, 17.49, 10.72, 13.08, 18.87, 12.27, 14.04, and 11.14. These valuations are as close as you can get to a steal in this market.



How to exploit:

1. Trade $XLF. It's a high volume ETF that tracks the financial sector of the S&P 500. Of the banks announcing earnings this week, its holdings include $C, $JPM, $PNC, and $WFC. I would expect good results among these banks to raise share prices among the rest of the holdings of $XLF. Simply buying $XLF is the safe play.
2. Buy calls in $XLF. Pretty straightforward.
3. Buy $FAS.This is a 3x leveraged ETF tracking the financial sector. It tracks all of the banks announcing earnings this week, among others. It has average volume of around 2.3 million shares per day at a price of around $65, so it's big enough that liquidity won't be an issue. This is what I'm doing.
4. Buy calls in $FAS. This is only for those who play Russian roulette for fun. DON'T DO THIS.

For any of these methods, I would buy in the next couple days. With today's gains, I feel like there are decent odds of a pullback. Look for buying opportunities. In any case, convert as much to cash as you can, and buy in NLT COB Wednesday, and you will see sweet gains by the end of Friday.",0.5,"[""Company | Symbol | Price | Daily Change | 52W Change\n:-------|:------:|:------:|:------:|:------:\nBank Of The Ozarks Inc | OZRK | 47.485 | +1.42% | -4.6%\nWells Fargo & Co | WFC | 53.125 | +1.71% | -3.1%\nWisdomTree U.S. MidCap Dividend Fund | DON | 34.12 | +0.83% | +5.6%\nFacebook Inc | FB | 159.835 | +1.68% | +13.5%\nSPDR Select Sector Fund - Financial | XLF | 27.775 | +2.23% | +18.1%\nCitigroup Inc | C | 70.665 | +3.01% | +18.9%\nJp Morgan Chase Co. | JPM | 112.475 | +3.1% | +30.5%\nDirexion Financial Bull 3X Shares | FAS | 64.863 | +5.88% | +48.6%\nAmazon.com Inc. | AMZN | 1428.31 | +1.64% | +59.6%\nNetflix Inc | NFLX | 295.77 | +2.4% | +106.7%\n\n[*](https://iextrading.com/developer/ 'Data from IEX')*[13-Week Price Moves](https://storage.googleapis.com/echoapollo-assets/charts/20180409 13h17-jhosZ-linechart.png) - [52 Week Price Change](https://storage.googleapis.com/echoapollo-assets/charts/20180409 13h17-jhosZ-barchart.png) -  quote-bot by [echoapollo](https://www.reddit.com/user/echoapollo)*""]"
PNC04-13,8azuz6,Money market funds now paying 1.75%+ interest,1523292041.0,78,138,"Banks have been very slow to increase interest on savings accounts. Many large banks still have the nerve to pay no interest. A quick check shows that in my zip code, BoA, PNC, and Wells Fargo each pay 0.01% to 0.03% interest on their basic savings accounts. If you jump through hoops by having a checking account with them and meeting account minimums, hopefully avoiding the $5-$12 account service fee, they pay a whopping 0.06%, 0.10%, and 0.32% interest, respectively. Even bank money market savings accounts pay very little interest, at 0.03% with PNC Bank. Unless you're with an online bank like Ally, a credit union, or another bank that is particularly aggressive about their savings account interest rate, you're probably getting ripped off.

Vanguard's prime money market fund pays 1.74% interest currently with no account service fee, although given, it does require a minimum of $3000 to start. But if you already have investments with vanguard or another mutual fund company, it's a no brainier to use their money market fund as your savings account rather than your bank savings account. I keep a $100 cash buffer in my checking account, credit cards for emergencies, and then my savings are in Vanguard's prime money market fund beside my taxable investment and retirement accounts.

I just wanted to point this out since it feels like increasing mutual fund money market rates have flown under the radar. It's kind of upsetting to me because I feel like people are getting robbed. Meanwhile, mutual fund money market accounts could be paying 2.5% interest by year end, with essentially no risk to principal.

On another note, does this change anyone's investment strategy? I'm thinking that retail investors, seeing saving account rates go up alongside increasing market volatility, may reallocate more into cash, pushing markets down further.",0.91,"['So there is some *slight* risk involved in MMFs compared to a savings account.\n\nFor one, they are not FDIC insured so if the fund goes belly up you\'re hosed.\n\nSecond, there\'s an extremely rare phenomenon called ""[Breaking the Buck](https://www.investopedia.com/terms/b/breaking-the-buck.asp)"" wherein the fund\'s NAV falls below $1. AFAIK it\'s only happened one time to one institution and a reputable institution like Vanguard likely would never have this happen to them, but there is a non-zero chance of it happening.', ""noob question- what's the difference in vanguard's prime MM fund and their federal MM fund?  I have the federal as my settlement/sweet holding. "", 'Thanks for the info. I’m currently using Discover saving with 1.5%. I’ll be checking out Vanguard’s money market.', 'You are right that the big brick and mortar banks have crap savings, but high yield savings accounts (Discover, Barclays, Ally, etc.) pay about 1.40-1.60% right now. ', 'Thanks for this!  I’m using Ally and TreasuryDirect as my savings. Interest from Treasuries is not subject to state and local tax. Makes a 9% marginal rate difference for me. \n\nAs far as how it affects my investment behavior I’ll say this:  I view interest rates in savings accounts and treasuries as a zero risk way to reduce the purchasing power I lose to inflation. \n\nRight now inflation is ~2% and i can get 1.3 - 1.6% yield after tax on savings and treasuries.  I view my saving’s purchasing power as only losing 0.5 - 1.0% in today’s environment. If the spread between after tax yield and inflation widens I’ll consider becoming more risk tolerant.\n\nRight now with all the volatility and small spread between inflation and interest rates I’m not buying equities in a taxable account. I’m more interested in preserving my saving’s purchasing power in the short term. Still investing lots in 401k/IRA.  But I’m young so that’s rarely not going to make sense at my age. ', ""Newbie question, how volatile is the return on Vanguard's money market fund? Is it pinned at 1.75% until their next announcement? Is there anywhere to find its history?"", 'Purepoint Financial (Union Bank’s online savings) has a 1.75% interest rate as of a few days ago. $10k min, but removes any worry about MM vs. traditional savings accounts. ', ""I guess I'm a bit confused--are these mutual funds? How is this different than something like a high yield savings account from ally or something?"", 'CIT Bank is at 1.75% in their Money Market account.  I think the only requirement is an initial deposit of $1000.  No minimum balance after its open.  No activity requirements.  ', '[deleted]', ""Why would you use a money market account when there are banks out there with FDIC insured accounts that offer 2%? Though if it hits 2.5% like you said might happen then of course that's a different story.\n\nLike [populardirect](https://www.populardirect.com/products/savings/popular-direct-exclusive-savings) which gives you a 2% savings account with seemingly no crazy [fees](https://www.populardirect.com/pdfs/513_Popular_Direct_Exclusive_Savings_Account_Disclosure.pdf). Only thing is you need $5k initial deposit, must keep over $500 in the account if you don't want to get hit with a fee, must have activity once a month, and to not close the account within 6 months."", 'All I know is that Ally used to be a leader in ""high"" interest rates, now they are slipping.', 'Purepoint financial online bank has 1.75% interest savings with a 10k minimum', ""With capital gains tax, management fees, less liquidity, and lack of insurance -- is it worth the extra % over a high yield savings account?\n\nBut to answer your question, it doesn't really change my strategy, but does make me feel much happier about moving to cash."", 'Santander Bank is paying 1.70% on balances over $10,000', 'Silly question: in current environment of decreasing bond yields and Feds raising interest rate does this look like a better option to $BND?', ""I'm getting 1.3% out of my pnc premier money market account. It's insured too https://www.pnc.com/en/personal-banking/banking/savings/premiere-money-market.html"", ""Thanks for posting this. I have my money in Discover savings which is at 1.50 right now. I didn't realize Vanguard would be higher, and I already have an account there.\n\nI'm wondering though, the fund you mention has an expense ratio of 0.16%. Does that lower the 1.74 or is it figured in? "", ""I'm sorry but this is terrible advice. Money market funds are NOT savings accounts. If you want a high yielding savings account put your money in an online savings account like Marcus from Goldman offering 1.50%. "", 'Well i am not sure if you are aware of insight or netspend, but they pay like 5% on some limited amounts but with very minimal requirements to meet. I just use those for my monies!\n\n i have a blog post on how to make it all work. Cant post it here because of sub rules but feel free to pm me. ', 'If you account for inflation, money market funds are paying around minus 0.5 percent. ', 'There are savings accounts with 2% interest with no requirements and other accounts up to 9% with requirements. ']"
PNC04-13,8b0n07,This is the week for gains in the financial sector. DD inside. (x-post to r/wsb),1523297810.0,1,0,"TL;DR: I think there is strong possibility of strong gains to be had this week in the financial sector. Buy in by COB Wednesday to take advantage, and exploit using $XLF options or $FAS.

Thesis: The financial sector is one of the most undervalued in the market right now, and as earnings season begins I expect the market to finally give the sector the attention it deserves. Reasons:

1. The financial sector is tremendously undervalued right now when you [simply look at ratios](https://us.spindices.com/documents/commentary/dashboard-us-select-sector-2018-03.pdf?force_download=true). At 18.3, the financial sector currently has a P/E ratio that is not only the lowest in the S&P 500, but [is in line with historical P/E ratios](http://www.multpl.com/), unlike many sectors right now. 
2. Earnings should be strong for a couple reasons. One of these reasons is that net interest margins, the difference between the interest a bank pays and the interest it receives, [has been expanding](https://www.nasdaq.com/article/jpmorgan-citigroup-wells-fargo-and-pnc-financial-are-part-of-zacks-earnings-preview-cm945379), possibly more than analysts have been expecting.
3. Another reason to expect strong earnings is strong economic fundamentals. The market has had ADHD recently with concerns about tariffs, $FB data usage, Trump tweets about $AMZN, and so on. Investors have lost sight of the fact that the economy is pretty strong right now, but earnings season will remind them of that. We have great job numbers, rising household incomes, high consumer confidence, and so on. These are conditions that lead to high use of the financial sector among both consumers and industry.
4. Another reason for strong earnings is this is the first quarter of earnings after tax reform. Enough said.
5. FAANG may finally be becoming passe. I realize as I am typing this that $NFLX is up 3.5% today (though on low volume) even though it has a P/E ratio around 232, but the market seems a bit more skittish around tech ever since the Cambridge Analytica news came out. Retail investors are being dumb and buying the bubble, but [big investors are very short on tech right now](https://blogs.wsj.com/moneybeat/2018/04/09/hedge-funds-turn-bearish-on-tech-giants/). (If you don't have access for WSJ stop being a pleb. Ask mom to buy you a few less tendies this week and get you a WSJ sub instead) [Valuations for tech right now are insane](https://us.spindices.com/documents/commentary/dashboard-us-select-sector-2018-03.pdf?force_download=true), and buying in right now seems to be typical WSB buy high sell low autism.
6. This week kicks off earnings season. On Thursday, [$OZRK and $CBSH announce premarket](https://www.nasdaq.com/earnings/earnings-calendar.aspx?date=2018-Apr-12). On Friday, [$C, $FHN, $FRC, $JPM, $PNC, and $WFC are all announcing premarket](https://www.nasdaq.com/earnings/earnings-calendar.aspx?date=2018-Apr-13). All of these are forecast to have improved YOY EPS, and some of them significantly so. P/E ratios for these are respectively: 14.14, 20.62, none, 27.41, 21.09, 17.86, 14.57, and 13.06.
More importantly, one year forward P/E ratios for these are respectively: 12.65, 17.49, 10.72, 13.08, 18.87, 12.27, 14.04, and 11.14. These valuations are as close as you can get to a steal in this market.



How to exploit:

1. Trade $XLF. It's a high volume ETF that tracks the financial sector of the S&P 500. Of the banks announcing earnings this week, its holdings include $C, $JPM, $PNC, and $WFC. I would expect good results among these banks to raise share prices among the rest of the holdings of $XLF. Simply buying $XLF is the safe play.
2. Buy calls in $XLF. Pretty straightforward.
3. Buy $FAS.This is a 3x leveraged ETF tracking the financial sector. It tracks all of the banks announcing earnings this week, among others. It has average volume of around 2.3 million shares per day at a price of around $65, so it's big enough that liquidity won't be an issue. This is what I'm doing.
4. Buy calls in $FAS. This is only for those who play Russian roulette for fun. DON'T DO THIS.

For any of these methods, I would buy in the next couple days. With today's gains, I feel like there are decent odds of a pullback. Look for buying opportunities. In any case, convert as much to cash as you can, and buy in NLT COB Wednesday, and you will see sweet gains by the end of Friday.",0.5,"[""Company | Symbol | Price | Daily Change | 52W Change\n:-------|:------:|:------:|:------:|:------:\nBank Of The Ozarks Inc | OZRK | 47.485 | +1.42% | -4.6%\nWells Fargo & Co | WFC | 53.125 | +1.71% | -3.1%\nWisdomTree U.S. MidCap Dividend Fund | DON | 34.12 | +0.83% | +5.6%\nFacebook Inc | FB | 159.835 | +1.68% | +13.5%\nSPDR Select Sector Fund - Financial | XLF | 27.775 | +2.23% | +18.1%\nCitigroup Inc | C | 70.665 | +3.01% | +18.9%\nJp Morgan Chase Co. | JPM | 112.475 | +3.1% | +30.5%\nDirexion Financial Bull 3X Shares | FAS | 64.863 | +5.88% | +48.6%\nAmazon.com Inc. | AMZN | 1428.31 | +1.64% | +59.6%\nNetflix Inc | NFLX | 295.77 | +2.4% | +106.7%\n\n[*](https://iextrading.com/developer/ 'Data from IEX')*[13-Week Price Moves](https://storage.googleapis.com/echoapollo-assets/charts/20180409 13h17-jhosZ-linechart.png) - [52 Week Price Change](https://storage.googleapis.com/echoapollo-assets/charts/20180409 13h17-jhosZ-barchart.png) -  quote-bot by [echoapollo](https://www.reddit.com/user/echoapollo)*""]"
