INDEX,id,post_title,created_at,num_comments,score,selftext,upvote_ratio,comments
SRE08-06,94flk7,Utilities as a growth stocks with the adaptation of electric cars?,1533348481.0,12,2,"California seems to be the early adopter of electric cars.

Pacific Gas and Electric, San Diego Gas and Electric, and Southern California Edison comprise approximately three quarters of electricity supply in California

San Diego Gas and Electric is owned by Sempra Energy - NYSE: SRE

PG&E, Pacific Gas and Electric - NYSE: PCG

Southern California Edison owned by Edison International - NYSE: EIX

none of the above stocks look particularly attractive.  They all have PE/G ratios in the 3s

I read somewhere it costs between $30-50 per month to charge an electric car for the average user.  According to a google search I just did that seems off, the average residential electric bill is a little over $100, so potentially selling 50% more electricity to select users could catch investors off guard and rally earnings as electric car adoption happens. 

The utility wires are already there, so it could essentially be an opportunity to sell more product especially during the evenings.  

What are everyone's toughs on this idea?



",0.67,"['Your investment thesis would not work. The reason is because regulated utilities don’t make more money by selling more electricity. Their profits are dependent entirely on a rate of return off their asset base that is set by the PUC. ', ""Most of the electric utilities are regulated.  The regulatory body sets their rates such that they make a small profit.  If demand increases due to electric cars, it won't go the bottom line as pure profit.  The regulatory agency will take it into account and adjust rates so that the utilities will continue to make their small profit."", ""Electric utility demand will be threatened by solar long-term. Electric cars may help increase demand. Remains to be seen which impact will be bigger. Electric cars might actually charge during the day, as that's when people work and when solar electricity would be highest. Electric demand might also go down due to way more efficient lighting (LEDs), less use of inefficient TVs (now mostly thin LED TVs), and less use of desktop computers. "", 'Ali G, is that you?']"
MAR08-06,947q7o,The ''you will make a fortune'' sectors?,1533283469.0,12,0,"Like the  petroil in 900th century  ( Rothschild's fortune ) there will be tecnlogical  advances in every century  and those  will make  the fortune of the fewer  who invest on it.

If I  would say to name  some possible bets on which  to invest in, what  would you name?

I would say:

\- Graphene or Maxene

\- CRISPR

\-STEEM  CELL tecnological

\- robotic prostheses

\-Elium3

\-Asteroid mining

Some  are more futuristic 50 years from now on ( -Elium3, Asteroid mining on the moon/Mars), some others  are JUST AROUND   THE CORNER (CRISPR, GRAPHENE / MAXENE)

What  are your bets  for a  Rothschild fortune like?",0.45,"['Um, the Rothchilds made their money extending credit to governments (particularly the French and British) and helped finance the expansion of colonialism into S. America. They had nothing to do with oil.\n\nSo really: government bonds would be your answer...\n\n(the Rockafellers were the vastly wealthy family because of oil (surpassed by the Getty family for their tankers and expansion into Saudi Arabia))\n\n', 'Government bonds.', 'Hopefully AI ', ""Masayoshi Son's bet is on The Singularity."", 'you are way too optimistic about the future.\n\n- nuclear winter fallout shelters\n- private military protected island nations keeping away the starving masses displaced by global warming / food and water shortages']"
DIS08-07,93t3y9,How do we feel about $DIS Earnings Next Week,1533158171.0,11,1,"For those who are following $DIS what are you expecting out of their earnings presentation next week? 

I'm confident based on my DD that they should beat expectations - I'm hoping to get a nice 3-5% jump in share price out of it. What do you guys think? ",0.56,"['They’ll show great growth, healthy profit margin, discuss how they’re lined up for greatness and as usual the stock will drop :| ', '[deleted]', ""Do you think poor Solo results will hurt them? Looking to take a position and don't know whether to do it now or after earnings. Thoughts?"", ""Company | Symbol | Price | Daily Change | 52W Change\n:-------|:------:|:------:|:------:|:------:\nWalt Disney Co | DIS | 112.97 | -0.52% | +2.1%\n\n[*](https://iextrading.com/developer/ 'Data from IEX')*[13-Week Price Moves](https://storage.googleapis.com/echoapollo-assets/charts/20180801%2016h16-uP5K6-linechart.png) -  quote-bot by [echoapollo](https://www.reddit.com/user/echoapollo)*"", ""I think that no one really knows how they'll report. It's an overall strong company. Hold on to it, and don't fret over the quarterly earnings. ""]"
NVDA08-16,95zbh6,NVDA vs. Tencent,1533841131.0,12,4,"Both have upcoming earnings reports, I am 21 and looking to make about a $1,250.00 position in either one after evaluating them both, both in my opinion are very profitable and have room for growth. With the new NVDA likely coming out soon and announcement probably August 20th could make a big jump. In the past I have been very bullish about TCEHY because it is basically the all in one Chinese Tech stock and with China's current market situation I think you can get it currently at a discounted price. Give me all of your opinions which I should choose. 

*EDIT* Both have very diversified revenue streams in my opinion and are pretty safe bets. What is also your opinion on CCI? ",0.62,"['I\'d call both very appealing companies with long-term growth stories, but I wouldn\'t call them ""safe.""', 'How is NVIDIA revenue diversified? As far as I can tell, they have 3 main revenue streams: crypto (in peril), deep learning (in peril), and video gaming. They are facing competition not only from Intel and AMD, but their prominent AI customers (Google, Tesla) have shown that they are willing to invest in first-party training and inference solutions. GPUs are certainly easier to scale than CPUs, and they have demonstrated tremendous pricing power, so there is certainly potential for further growth, but the risks seem understated.']"
DE08-17,96qvmr,Dishonest hysterical speculation around Elon taking Tesla private.,1534096336.0,26,0,"So while nearly everyone on here is circlejerking and proclaiming Elon guilty with little more than speculation, innocent until proven guilty be damned when it comes to the cult of Tesla bears and haters. I’ll speculate far more reasonably on what is actually happening. Elon has the financial backing from a handful of big players, likely led by google and Elon’s longtime friend Larry Page, who offered to take Tesla private in [2012 for a deal worth $11 billion](https://www.entrepreneur.com/article/245323). So the basic outline is Elon has the funding needed secured but he would prefer to diversify ownership to prevent any one or two players from having a de facto controlling stake. What is going on behind the scenes now is Elon working to diversify the deal over a number of big investors, but even if that fails he still has the big 2 or 3 backers there. ",0.31,"[""So why wasn't the board made aware of this plan?  \n\nWhy hasn't an 8-K been filed?  \n\nWhy wasn't the stock halted until Nasdaq forced Tesla to do it?  \n\nWhy, after the stock was halted, did we just see some bullshit email instead of an actual proposal naming the parties involved?  \n\nWhy weren't any firms or financial analysts hired to analyze and price a potential privatization until just a few days ago?\n\nWhy hadn't major shareholders been notified/questioned to vet support?\n\nThere's a million things pointing to this not being thought out and no firm offering on the table here, which would constitute securities fraud.  Multiple exchange personnel, former SEC staff and investigators have literally commented on it laying out what needs to be shown here and as of yet it hasn't been.\n\nRealistically even if he wants to diversify and fund this is a terrible way to do it too.  You want other parties that might be interested to know you have people to make this go through.  You want that FOMO in full force to drive a bidding war.\n\nYet we've seen nothing so far despite Tesla being required by law to disclose these things.  Is it strictly impossible there was some buyer or small consortium of buyers?  No, not yet given the lack of public commentary or regulatory filings.  There's just no reason for someone who legitimately wanted to take a company private to operate in fashion though.  Even if it's legit and he wanted to burn/dissuade short sellers the stock has literally dropped because of the failure to disclose such details.\n\nSo no there haven't been charges filed or hard proof this is false right now but there's loads of reasons to expect at least some of the claims are.  It clearly hasn't been vetted or reviewed by the board contrary to Musk's claim that the only holdup is a shareholder vote and that much has been confirmed at this point.  There's a mountain of reasons to expect that there's some degree of lying or foul play here and almost none to expect that this is some legitimate operating strategy.\n\n"", '[deleted]', ""Lets assume you're right. So assuming he does have the funding from 2 or 3, or maybe even (optimistically) 6 or 7 backers, and let's assume he does have the future capital available to drive the price up another 20%. I haven't checked the recent stock price, so take that percentage change with a grain of salt.\n\nAssuming that your logic is correct, did he tweet about going private to manipulate the stock price and manufacture a short squeeze? Probably. He isn't shy about his hate of the shorts, he has made many public comments about how he hated the haters. Whether he has the private funding or not, it feels like he did this intentionally to manipulate the stock price. \n\nAlso, what will the board say about it? Well, elons brother is on the board, so I think we'll know how at least one person will feel about it, but what about the rest?"", 'You also don’t know either. You likely have a vested interest in Tesla and are speculating like everyone else.\n\nMy BIL cancelled his Model 3 order.\n\nLet us know when there’s a $35k Model 3.', ""'Elon'"", 'Your point has been ignored, the anti-Tesla circlejerk will continue as planned.']"
SJM08-21,983doe,"What are some of the""best"" stocks for life?",1534520974.0,36,0,"In quotes obviously, but I'm looking for the best stocks to simply buy and leave in my account for preferrably 40 years so I can be the laziest asshole ever after retirement. I most like the idea of great dividend stocks but I want opinions from people who have been in the market longer than a half year. My current ""4life"" stakes are UPRO, URTY, MSFT, V, DIS, MGP, IRM, & MPW. 




EDIT :  Currently ""added"" tickers: PEP, SYY, COST, GIS, TEVA, PYPL, MMM, PG, DG, T, & SJM. 

(Added as in watching for entry or literally)

Replacing UPRO with SPY

Replacing URTY with IWM

",0.5,"['SPY', 'GE was 4Life too at one point.', 'Don\'t get me wrong. I own Microsoft and I believe in its future.\n\n40 years ago Microsoft had just started (1975 founded) and we were living without the technology we use and love today.\n\nTechnology changes **fast**.\n\nOur major technological advances have gotten closer and closer together. We went from Telephone in 1876, Radio in 1895, Television in 1927, ""Modern"" Computers in the 1950s, Cellphone in the 1980s, Internet in 1983, Internet & American Online being widely available to the public in 1990, Personal Computers in the 1990s and Smartphones in the 2000s.\n\nAs you can tell the advances have gotten closer and closer together. Technology can change in an instant.\n\nWhat hasn\'t changed, but isn\'t as sexy is things like toilet paper, tampons, pads, diapers, kleenex, food, water. If you are going to invest in something for 40 years. Look into companies that provide the essentials.', ""I'm gonna say something you think has good long term growth prospects with dividends and/or the prospect of dividends, and perhaps most importantly, the prospect of dividends increasing. So that you can reinvest those dividends and continue to grow your investment no matter what the market is doing.\n\nThe ones in my portfolio that meet this description are V, MSFT, DIS, QCOM, VFC, ROP, COST, DG, FMC, TROW, COST, CVX, LYG, BT, C, MRK, MGA, DG, BT, NEE\n\nSome of those dividends are small, but I think you can expect them to grow over the years and decades.\n\nThere are also some non-dividend payers that I think you can count on to pay dividends eventually. Again from my portfolio: PYPL, TEVA"", 'DIA I know it’s an ETF but imo it’s the right long term play.', 'BRK', 'check out this guy https://www.youtube.com/user/ppcian/videos', 'MAS WING']"
SJM08-21,98uce3,Dividend Growth Stock Investing,1534777414.0,15,0,"Some companies like KO or SJM have a history of increasing dividend rates. Buffett and others (e.g. https://www.youtube.com/user/ppcian) use a strategy of taking advantage of these dividend increases to achieve cash flows in the 20-30% range after a number of years. 

My question is on how this works. If I buy $1000 worth of KO shares now and buy an additional $1000 every subsequent year, what effective dividend rate will I achieve? Will all of these positions see the same dividend growth rate (assuming KO increases dividend each year)? Or will my staggered buying scheme only have the earliest purchases all seeing the dividend increases?

",0.43,"['Stuff you find on YouTube will generally not be high quality as it’s someone trying to sell you something. Better to read the starter articles on bogleheads.org and go the index route.', 'At current price, $33 bucks a year. \n\nhttps://www.dividendladder.com/tools/dividend-calculator/', ""Ppcian claims to have beat the index but when he broke it down it was one or two companies that he bought that beat the index and not his entire portfolio.\nhttps://youtu.be/6rhvz8-0TDY\n\nYou don't know what he knows and you don't know what he doesn't know.\n\nPpcian doesn't know how to measure performance and he doesn't know he doesn't know.  Hence, the convincing nature of his videos.\n\nYour best bet.  Go to the library and read.  After about ten books you'll realize which authors know what they're talking about.  Some authors, like ppcian, don't know what they don't know but still have the audacity to write a book or post a YouTube video about a subject they don't even understand.\n\nThink for yourself.\n"", 'You are paid, through dividends, a percentage of the stocks value. If a business pays out 3% dividends at the end of the year and you own 3 shares of the stock, you are effectively receiving 9% of the stocks value through dividends at the end of the year (or whenever dividends are paid).\n\nDividend rates will vary depending on the business. All shares will be paid dividends the same depending on what the business decides their rate should be, regardless of when shares were bought']"
TGT08-22,98x4bx,TGT/LOWES,1534796546.0,9,2,"With competitors Home Depot and Walmart having earnings out last week and blowing up expectations, Target and Lowes will be coming out this week as well.

What’s your analysis on TGT and Lowes?",0.57,['TGT is going to sky rocket. I go into target for one item and come out with a shopping cart full. Best place to pick up a chick is target. \nRatio is 10/1 and they’re already in there looking for things they don’t need. \nLong $TGT']
SNPS08-22,97u978,Why is the dow 1.61% now but snp is only .98%?,1534440152.0,10,0,Arent they suppose to match,0.21,"['No. They are different indexes made up of different baskets of stocks. ', 'If they were supposed to match there would only be one of them.', ""No.  The Dow is 30 stocks.  S&P 500 is about 500.  \n\nIt's hard to say why the Dow talked about at all.  Tradition maybe?"", 'Walmart', 'Walmart and Boeing were both up a lot, a big change either way in one or two stocks can make a big difference to the Dow.', 'We have got to be close to a market top', ""It's rigged bro""]"
MU09-20,9ftaq2,Micron (MU) undervalued?,1536941239.0,23,10,"I've been watching this rise of AMD. Reminds me a lot of the bitcoin run. With a PE of 110 and an EPS of 0.29, this AMD run seems purely speculation and momentum. Not necessarily negative, could be a lot of money to be made there... but I was late to the party so I'm staying away.

&#x200B;

Micron on the other hand seems to have better financials. PE of 4.4 and EPS of 10. Compare to Intel (PE 16, EPS 2; NVDA PE 40, EPS 8)... Qualcomm losing money... I realize looking at PE and EPS is reducing financial fundamentals quite a bit.

&#x200B;

But for their earnings, compared to earnings and stock price of competitors, micron seems wildly undervalued. The DRAM chips don't seem to be going anywhere... Especially with increasing demand for cloud computing. 

&#x200B;

I understand that potential oversupply of DRAM chips in the first half of 2019 is one of the major drivers of the price decline... But as a long term play, micron seems like a good buy to me. What do you all think?

 ",0.59,"[""I'm glad people are bring up Micron. There is such a dearth of conversation about this company."", 'You cant compare micron to Intel, amd, qcom. Micron gets 75% of rev from DRAM. Only 3 companies make Dram. Go look at pe or Samsung or sk hynix. That said\n https://www.cnbc.com/2018/09/14/credit-suisse-says-buy-micron-shares-because-the-chipmakers-stock-is-extremely-cheap.html', 'r/wallstreetbets welcomes you ', 'do we seriously need the exact same thread about this company every other day...', 'Since 2017 it was well predicted that oversupply would become a problem by late 2018.\n\nWhat drove Micron up was a shortage of DRAM.', 'This question is posted obsessively, every day! There have been threads saying MU is undervalued for months now. People have been losing tons of money, maybe that’s a buy signal. No one knows ', ""P/E is only relevant if you have confidence in the denominator. With INTC, my EPS could differ dramatically from your EPS, but with MU, my EPS will likely differ from your E by a larger magnitude. This is called uncertainty and uncertainty leads to lower multiples. \n\nWhat if I told you MU's 2019 EPS is actually like $5? Then we're talking 9x EPS for MU, which is damn expensive. What if I told you NVDA will earn $10 in 2019? That's 28x EPS and that's damn cheap for NVDA. \n\nLonger-term I am bullish MU, but one cannot make decisions based on the multiple, but rather, the investor needs to hone in on his conviction in the denominator. With MU, this is especially important. "", 'In 2016 this was a sub $10 stock because it was losing money.', ""How are you going to compare AMD to Bitcoin LUL. You brought up PE but said nothing about the growth prospects of said company. That is what matters with PE. AMD can create value but Bitcoin can't. AMD and Bitcoin can't be compared to each other\n\nAnd for MU, what is your projected forward PE? I bet it is somewhat higher "", ""Earnings aren't stable, if they will go down 50% then the P/E doubles to 20.\n\nThe fact is that MU has been weak at innovation and was able to keep going through acquisitions. Now there's  nobody left to buy but we've reached the physical limits so maybe this will give a couple of years of non-innovation.\n\nIt doesn't pay any dividend and it's cyclical... So it's not that it deserves high PEs...""]"
MU09-20,9gxr8k,$MU seems to be the only 'Meme stock' that makes technical sense.,1537297668.0,24,7,"So after circle jerking over AMD in WSB, I took a second to look into $MU

http://m.wolframalpha.com/input/?i=mu+stock

P/E ratio: 4.9

Net Income: 10b

Debt Capital: .23

Net profit margin: +45%


This company literally makes the DRAM, the Ram found in all Graphic cards.

I know they aren't the flashiest company, but I still can't wrap my head around why they are so grossly undervalued. ",0.7,"['Most analysts forecast a drop in DRAM prices in going into 2020. The PE is compressed but this is due to expectations of negative future earnings, which they have had in the past. I really want to buy those fundamentals but sustainable profitability is questionable.', 'Not only does it make techinal sense, it makes fundamental sense too. Buying some for the long haul.', 'The market is cyclical.  Apparently everyone but WSB knows this.\n\nSee also: people dumping money in to automakers over the last few years because they were ""cheap"". ', ""Company | Symbol | Price | Daily Change | 52W Change\n:-------|:------:|:------:|:------:|:------:\nMicron Technology Inc | MU | 45.405 | +4.19% | +28.2%\nAdvanced Micro Devices Inc | AMD | 32.09 | -1.05% | +145.3%\n\n[*](https://iextrading.com/developer/ 'Data from IEX')*[13-Week Price Moves](https://storage.googleapis.com/echoapollo-assets/charts/20180918%2014h08-zLtDo-linechart.png) - [52 Week Price Change](https://storage.googleapis.com/echoapollo-assets/charts/20180918%2014h08-zLtDo-barchart.png) -  quote-bot by [echoapollo](https://www.reddit.com/user/echoapollo)*"", ""I'm sorry but what is a Meme stock? 😭"", 'Agreed, it does seem undervalued based on its substantial profitability numbers.', 'Projected to make 8 billion this quarter? Commodity or not this company has never made this much money.', 'the sad thing for MU is, the best time to dump MU stocks is when they have record high profits. And the best time to buy MU stocks is when they have record high losses.', ""> This company literally makes the DRAM, the Ram found in all Graphic cards.\n\nUhhhh no. Hynix + Samsung make AMD Vega64 HBM2. Samsung also makes NVidia's GDDR6 for Quadro.\n\nMU is only  making the GDDR5x and GDDR6 for NVidia Geforce cards (like the 1080, 2080). But even something like V100 uses Samsung for the higher-margin / higher-performing HBM2.\n\nHonestly, the bull-case for $MU is pretty simple: they're a major RAM company based in the USA. So it got dat Department of Defense money. But in the short term, $MU's next generation HMC seems stillborn (Micron's competitor to HBM), Flash prices are nosediving, 3d XPoint is very meh, and Samsung seems to make superior RAM.\n\nIMO, its a bad year for $MU and it makes perfect sense why they're nosediving this year. They're gonna stick around of course, they're a staple US company. But 2018 was not a good year for them.""]"
MU09-20,9fisl1,Good time to buy mu?,1536851289.0,4,2,"At $43, had a very low P/E ratio for what seems to be a solid company.",0.56,"[""half of r/wallsteetbets is losing their shirt on this stock because it looks so juicy but it keeps trending down. personally i'm a buyer in the low 40's i think it will pop eventually and i love a good deal"", 'Buy the trend.\n\nEdit: The trend is downwards. Wait for the movement. ', 'Yup. If your time frame is years. Short term this could get slapped down if ER is meh. ']"
INFO09-25,9hlfdl,Info on Mainstay portfolio family,1537497351.0,3,1,"I have an annuity through New York Life and their fund offerings are heavy with funds from the Mainstay family.  Does anyone have any opinion on these (Mainstay) in general?  Or NYL annuities in general.  
 
I tried to cross-check them on E-Trade but they don't pop up on the E-Trade search.  

There are other slim pickings from Dreyfus and Janus as well.

Thanks 
",0.66,"[' Not surprising they offer Mainstay funds, that is their fund company. ']"
WFC10-12,9mnoig,Banking stocks,1539077316.0,4,2,"WFC, BB&T, C , etc which one would you buy and hold for the next 5-10 yrs or bank etf?",0.67,"['Glad I’m not the only one who likes BK 🤨', 'Holding WFC and BK. \n\nThey didn’t perform well compare with JPM BAC, but that is exactly they are reasonably price at the moment.']"
